{"accepted_history":["policy-sequence-30","revocation-sequence-31","fixture-primary-withdrawal-sequence-32","fixture-mirror-withdrawal-sequence-33"],"anti_rollback_floor_sequence":31,"anti_rollback_result":"conformant-for-revocation-floor-and-registered-channel-history-scope","boundary":"registered-content-revocation-distribution-withdrawal-anti-rollback-closure","claim_boundary":["content-revocation-does-not-erase-published-bytes","registered-channel-withdrawal-does-not-prove-global-unavailability","anti-rollback-does-not-prove-absence-from-unregistered-mirrors","revocation-does-not-establish-vulnerability-remediation","withdrawal-does-not-establish-durable-purge","fixture-control-root-does-not-prove-real-world-operator-identity","p1-a13-does-not-imply-live-github-or-registry-publication"],"content_archive_sha256":"0e3ce06e9ef4f9299ad5ade9182d3924704248230d924bec656562d58287960e","content_revocation_result":"conformant-for-exact-release-content-scope","distribution_withdrawal_result":"conformant-for-two-registered-fixture-channels-scope","global_content_unavailability_result":"not-claimed","overall_result":"conformant","policy_envelope_sha256":"4943cfe4604d14d5d19bccfc06d79b7fe63d7f85663711e344dc01d0091920c2","profile":"registered-content-revocation-withdrawal-anti-rollback-v1","registered_channel_ids":["fixture-primary","fixture-mirror"],"release_descriptor_sha256":"1551056d0b903f3f74b0c4834c7dd60720ea651f3608c2ee3ea9b302a2b9f5ec","release_id":"eigiib-p1-a7-authority-1.0","replay_results":[{"decision":"rejected-below-revocation-floor","id":"pre-revocation-sequence","sequence":30},{"decision":"rejected-revoked-content","id":"at-revocation-floor","sequence":31},{"decision":"rejected-revoked-content","id":"newer-sequence-same-content","sequence":34}],"revocation_envelope_sha256":"f15badfb9b3c36468f2f8af72be9fa8263731d334b8a55526079cccfe94ea9ed","revocation_id":"eigiib-p1-a13-revocation-1","revocation_sequence":31,"source_transparency_capsule_sha256":"12b3ca6c0ca260b3357993d65a8b4595f6cc23d4b8b26ca67dcee94e06148046","source_transparency_report_sha256":"7613429f8d3b771812433f5b57d64accb8148550ed9f8b71a38a97b23a45343c","standard":"EIGIIB-P1-A13-1.0","tool":"eigiib-p1-a13-revocation-check","tool_version":"0.1.0","trusted_effective_time_unix":1785603600,"vulnerability_remediation_result":"not-claimed","withdrawn_channel_ids":["fixture-primary","fixture-mirror"]}
